{
 "lang": "de",
 "exam": "goethe-b1",
 "about": "German strings of the Goethe B1 exam runner (Sie forms). Read by src/features/exam through exam.tx(); keys are named in content/exams/goethe-b1/exam.json and in the exam screens.",
 "strings": {
  "submit": "Abgeben",
  "submitFailed": "Die Abgabe hat nicht geklappt. Ihre Antworten sind auf diesem Gerät gespeichert. Bitte noch einmal versuchen.",
  "pause": "Uhr anhalten",
  "resume": "Uhr weiterlaufen lassen",
  "minutesLeft": {
   "one": "Noch {n} Minute",
   "other": "Noch {n} Minuten"
  },
  "take": "Aufnahme {n}",
  "sendNow": "Jetzt senden",
  "sendFailed": "Nicht gesendet: {why}. Die Aufnahme bleibt gespeichert und wird später gesendet.",
  "allSent": "Alles ist gesendet.",
  "rec.title": "Aufnahme",
  "rec.running": "Aufnahme läuft…",
  "rec.saving": "Wird auf diesem Gerät gespeichert…",
  "rec.savedSending": "Auf diesem Gerät gespeichert. Wird gesendet…",
  "rec.savedLocal": "Auf diesem Gerät gespeichert.",
  "rec.sentOk": "Gespeichert und gesendet.",
  "rec.notSentYet": "Auf diesem Gerät gespeichert, noch nicht gesendet. Sie wird später automatisch gesendet.",
  "rec.storeFailed": "Der Browser konnte die Aufnahme nicht behalten. Speichern Sie die Datei jetzt.",
  "rec.saveFile": "Datei speichern",
  "rec.sent": "gesendet",
  "rec.notSent": "auf diesem Gerät, noch nicht gesendet",
  "rec.denied": "Kein Zugriff auf das Mikrofon. Erlauben Sie es in den Browser-Einstellungen oder wählen Sie eine Datei.",
  "rec.unsupported": "Dieser Browser kann nicht aufnehmen. Wählen Sie eine Datei.",
  "rec.empty": "Die Aufnahme war leer. Bitte noch einmal.",
  "rec.stopFirst": "Beenden Sie zuerst die Aufnahme.",
  "rec.stoppedBySystem": "Das Telefon hat die Aufnahme beendet. Alles bis dahin Aufgenommene ist gespeichert.",
  "rec.recovered": "Eine durch Neuladen unterbrochene Aufnahme ist gespeichert.",
  "rec.has": "aufgenommen",
  "rec.hasNot": "noch keine Aufnahme",
  "submitSprechen": "Sprechen abgeben",
  "submitQ": "{module} abgeben?",
  "missingQ": "{list} ohne Aufnahme abgeben?",
  "final": "Danach können Sie nichts mehr ändern.",
  "keepGoing": "Weiter bearbeiten",
  "answered": "{n} von {of} beantwortet",
  "left": "Noch {t} Min.",
  "used": "{t} Min. vergangen",
  "timeUp": "Die Zeit ist abgelaufen.",
  "lowTime": "Weniger als 5 Minuten",
  "overtime": "Zeit abgelaufen, {t} Min. darüber",
  "paused": "Pausiert",
  "continue": "Weitermachen",
  "back": "Zurück",
  "next": "Weiter",
  "true": "Richtig",
  "false": "Falsch",
  "yes": "Ja",
  "no": "Nein",
  "yourRight": "Ihre Antwort, richtig",
  "yourWrong": "Ihre Antwort, falsch",
  "solution": "Lösung",
  "markRight": "richtig",
  "markWrong": "falsch, richtig wäre {right}",
  "why": "Warum?",
  "trap": "Falle:",
  "bySkill": "Fehler nach Aufgabentyp:",
  "allRight": "Alles richtig.",
  "ads": "Anzeigen A bis J",
  "l1": "Teil 1, 10 Minuten. Lesen Sie den Text und die Aufgaben 1 bis 6. Sind die Aussagen richtig oder falsch?",
  "l2": "Teil 2, 20 Minuten. Lesen Sie die beiden Texte und die Aufgaben 7 bis 12. Wählen Sie bei jeder Aufgabe die richtige Lösung a, b oder c.",
  "l3": "Teil 3, 10 Minuten.",
  "l4": "Teil 4, 15 Minuten. Lesen Sie die Kommentare zur Frage:",
  "l5": "Teil 5, 10 Minuten. Lesen Sie den Text und die Aufgaben 27 bis 30. Wählen Sie die richtige Lösung a, b oder c.",
  "h1": "Teil 1. Sie hören fünf kurze Texte. Sie hören jeden Text zweimal. Zu jedem Text lösen Sie zwei Aufgaben.",
  "h2": "Teil 2. Sie hören einen Text einmal. Sie haben 60 Sekunden, um die Aufgaben 11 bis 15 zu lesen. Wählen Sie a, b oder c.",
  "h3": "Teil 3. Sie hören ein Gespräch einmal. Sind die Aussagen 16 bis 22 richtig oder falsch?",
  "h4": "Teil 4. Sie hören eine Diskussion zweimal. Wer sagt das? Ordnen Sie die Aussagen 23 bis 30 zu.",
  "play": "Abspielen",
  "playing": "Läuft…",
  "reading": "Lesezeit…",
  "noPlays": "Keine Wiedergabe mehr",
  "readingLeft": "Lesezeit: noch {n} s",
  "skipReading": "Lesezeit überspringen",
  "secondIn": "Zweites Hören in {n} s",
  "soundCheck": "Ton prüfen",
  "playsLeft": {
   "one": "Noch {n} Wiedergabe",
   "other": "Noch {n} Wiedergaben"
  },
  "playsDone": "Keine Wiedergabe mehr",
  "audioMissing": "Die Audiodatei fehlt.",
  "audioBlocked": "Der Ton startet nicht. Prüfen Sie den Stummschalter und tippen Sie noch einmal.",
  "schreibenIntro": "Drei Aufgaben, zusammen 60 Minuten. Keine Hilfsmittel.",
  "a1hint": "Schreiben Sie etwas zu allen drei Punkten. Denken Sie an Anrede und Gruß.",
  "words": "{n} von ca. {target} Wörtern",
  "taskWords": "Aufgabe {i}: {n} Wörter (Ziel ca. {target})",
  "prepIntro": "15 Minuten Vorbereitung. Lesen Sie die Aufgabe für Teil 1, wählen Sie ein Thema für Teil 2 und notieren Sie Stichpunkte.",
  "t1": "Teil 1, Gemeinsam etwas planen (circa 3 Minuten). Machen Sie Vorschläge und reagieren Sie auf die Vorschläge Ihres Partners.",
  "t2": "Teil 2, Ein Thema präsentieren (circa 3 Minuten). Sprechen Sie frei mit Ihren Stichpunkten, Folie für Folie.",
  "t3": "Teil 3, Über das Thema sprechen (circa 2 Minuten). Beantworten Sie die Fragen zu Ihrer Präsentation.",
  "partnerStarts": "Ihr Partner beginnt. Erst die Aufnahme starten, dann „Nächster Satz“.",
  "cueOf": "Partner, Satz {i} von {n}",
  "partnerSpeaks": "Ihr Partner spricht…",
  "yourTurn": "Jetzt Sie.",
  "nextCue": "Nächster Satz",
  "prevCue": "Vorheriger Satz",
  "again": "Nochmal hören",
  "recStart": "Aufnehmen",
  "recStop": "Stopp",
  "recFile": "Datei wählen",
  "recFileOnly": "Aufnehmen oder Datei wählen",
  "showText": "Text zeigen",
  "hideText": "Text ausblenden",
  "rec1": "Eine Aufnahme für das ganze Gespräch.",
  "rec2": "Etwa 3 Minuten.",
  "rec3": "Eine Aufnahme für alle drei Antworten. Aufnahme starten, dann die Fragen nacheinander abspielen.",
  "afterSubmit": "Die Aufnahmen werden bei der nächsten Auswertung transkribiert und korrigiert.",
  "rulesLesen": "30 Aufgaben. Keine Hilfsmittel. Bei Pause wird die Aufgabe ausgeblendet. Ihre Antworten bleiben auf diesem Gerät, bis Sie abgeben.",
  "rulesHoeren": "30 Aufgaben. Sie hören jeden Text so oft wie in der Prüfung, ohne Zurückspulen. Kopfhörer auf, Stummschalter aus. Nach dem Abgeben können Sie alles mit Transkript nachhören.",
  "rulesSchreiben": "Keine Hilfsmittel. Rechtschreibprüfung und Autokorrektur sind aus. Ihr Text wird bei jeder Eingabe auf diesem Gerät gespeichert.",
  "rulesSprechen": "15 Minuten Vorbereitung, danach drei Teile mit je einer Aufnahme. Die Seite fragt nach dem Mikrofon. Jede Aufnahme bleibt auf diesem Gerät, bis sie gesendet ist.",
  "retake": "Neuer Versuch. Der letzte Versuch zählt.",
  "startModule": "{module} starten ({min} Min.)",
  "newTry": "Neuer Versuch ({min} Min.)",
  "startPrep": "Vorbereitung starten ({min} Min.)",
  "staleStarted": "Sie haben {module} am {when} angefangen.",
  "staleRules": "Weitermachen: Die Zeit seitdem zählt nicht. Neu anfangen: Die Uhr startet von vorn, Ihre Antworten bleiben.",
  "restart": "Neu anfangen",
  "restartQ": "{module} neu anfangen?",
  "restartDetail": "Die Uhr startet wieder bei {min} Minuten. Ihre Antworten bleiben.",
  "tabs": "Teile",
  "teil": "Teil {n}",
  "minShort": "{n} Min.",
  "startMinutes": "{topic} · {min} Minuten",
  "startSpeaking": "{topic} · {prep} Min. Vorbereitung, ca. {min} Min. Prüfung",
  "textKind": "Text {i} · {kind}",
  "h1Summary": "5 kurze Texte, je zweimal",
  "h2Summary": "ein Vortrag, einmal",
  "h3Summary": "ein Gespräch, einmal",
  "h4Summary": "eine Diskussion, zweimal",
  "aufgabe": "Aufgabe {i}",
  "taskStart": "{min} Min. · ca. {words} Wörter",
  "taskLabel": "Aufgabe {i} · {min} Minuten, ca. {words} Wörter",
  "taskJump": "Aufgabe {i} · {n}/{target}",
  "taskArea": "Text für Aufgabe {i}",
  "taskReview": "Aufgabe {i} · ca. {words} Wörter",
  "addressee": "An: {to}",
  "prep": "Vorbereitung",
  "prepShort": "Vorb.",
  "done": "Abgabe",
  "s1Summary": "Gemeinsam etwas planen",
  "s2Summary": "Ein Thema präsentieren",
  "s3Summary": "Fragen zur Präsentation",
  "s1Title": "Teil 1 · Gemeinsam etwas planen",
  "s2Choose": "Teil 2 · Thema wählen",
  "notes": "Stichpunkte",
  "notesFor": "Stichpunkte Teil {n}",
  "notes1Placeholder": "Ideen, Vorschläge, Redemittel …",
  "notes2Placeholder": "Folie 1: …\nFolie 2: …",
  "topic": "Thema",
  "slides": "Die fünf Folien",
  "slideOf": "Folie {i} von {n}",
  "slidePrev": "← Folie",
  "slideNext": "Folie →",
  "yourNotes": "Ihre Stichpunkte",
  "question": "Frage {i}",
  "recordings": "Aufnahmen",
  "recorded": "aufgenommen",
  "missing": "fehlt",
  "and": " und ",
  "notesTeil": "Teil {n}:",
  "reviewS1": "Teil 1 · Gemeinsam etwas planen",
  "reviewS2": "Teil 2 · Präsentation",
  "reviewS3": "Teil 3 · Fragen",
  "skill.detail": "Detail",
  "skill.global": "Hauptaussage",
  "skill.paraphrase": "Umschreibung",
  "skill.negation": "Negation",
  "skill.number-time": "Zahlen und Zeiten",
  "skill.attitude": "Meinung",
  "skill.inference": "Schlussfolgerung",
  "skill.matching": "Zuordnung"
 }
}
